{
  "version": 1,
  "task_id": "T-COMPACT-HANDOFF-001",
  "created_at": "2026-09-26T10:51:23.950Z",
  "entries": [
    {
      "code": " M",
      "path": ".agent-context/context-index.json"
    },
    {
      "code": "??",
      "path": ".agent-context/tasks/T-COMPACT-HANDOFF-001/brief.md"
    },
    {
      "code": "??",
      "path": ".agent-context/tasks/T-COMPACT-HANDOFF-001/change.yaml"
    },
    {
      "code": "??",
      "path": ".agent-context/tasks/T-COMPACT-HANDOFF-001/checkpoint-input.yaml"
    },
    {
      "code": "??",
      "path": ".agent-context/tasks/T-COMPACT-HANDOFF-001/context.lock.json"
    },
    {
      "code": "??",
      "path": ".agent-context/tasks/T-COMPACT-HANDOFF-001/evidence/implementation-fingerprints.json"
    },
    {
      "code": "??",
      "path": ".agent-context/tasks/T-COMPACT-HANDOFF-001/evidence/review-request.md"
    },
    {
      "code": "??",
      "path": ".agent-context/tasks/T-COMPACT-HANDOFF-001/evidence/verification.txt"
    },
    {
      "code": "??",
      "path": ".agent-context/tasks/T-COMPACT-HANDOFF-001/state.yaml"
    },
    {
      "code": " M",
      "path": "ARTIFACT_PROTOCOL.md"
    },
    {
      "code": " M",
      "path": "ROADMAP.md"
    },
    {
      "code": " M",
      "path": "docs/self-documentation.md"
    },
    {
      "code": " M",
      "path": "docs/usage.md"
    },
    {
      "code": "??",
      "path": "examples/compact-handoff/README.md"
    },
    {
      "code": "??",
      "path": "examples/compact-handoff/inventory.fixture.json"
    },
    {
      "code": " M",
      "path": "schemas/handoff.schema.json"
    },
    {
      "code": "??",
      "path": "schemas/worktree-inventory.schema.json"
    },
    {
      "code": " M",
      "path": "src/cli.ts"
    },
    {
      "code": " M",
      "path": "src/handoff.ts"
    },
    {
      "code": " M",
      "path": "src/initializer.ts"
    },
    {
      "code": " M",
      "path": "src/resume-audit.ts"
    },
    {
      "code": " M",
      "path": "src/resume.ts"
    },
    {
      "code": " M",
      "path": "src/validator.ts"
    },
    {
      "code": "??",
      "path": "src/worktree-inventory.ts"
    },
    {
      "code": "??",
      "path": "test/compact-handoff.test.ts"
    },
    {
      "code": " M",
      "path": "test/handoff.test.ts"
    }
  ]
}
