{
  "version": 1,
  "task_id": "T-VALIDATION-MEMORY-001",
  "created_at": "2026-10-09T19:51:42.526Z",
  "entries": [
    {
      "code": " M",
      "path": ".agent-context/context-index.json"
    },
    {
      "code": "??",
      "path": ".agent-context/tasks/T-VALIDATION-MEMORY-001/brief.md"
    },
    {
      "code": "??",
      "path": ".agent-context/tasks/T-VALIDATION-MEMORY-001/change.yaml"
    },
    {
      "code": "??",
      "path": ".agent-context/tasks/T-VALIDATION-MEMORY-001/checkpoint-input.yaml"
    },
    {
      "code": "??",
      "path": ".agent-context/tasks/T-VALIDATION-MEMORY-001/context.lock.json"
    },
    {
      "code": "??",
      "path": ".agent-context/tasks/T-VALIDATION-MEMORY-001/evidence/verification.md"
    },
    {
      "code": "??",
      "path": ".agent-context/tasks/T-VALIDATION-MEMORY-001/state.yaml"
    },
    {
      "code": " M",
      "path": "ARTIFACT_PROTOCOL.md"
    },
    {
      "code": " M",
      "path": "ROADMAP.md"
    },
    {
      "code": " M",
      "path": "src/validator.ts"
    },
    {
      "code": "??",
      "path": "test/validation-memory.test.ts"
    }
  ]
}
