{
  "version": 1,
  "task_id": "T-PUBLISH-CONTINUITY-001",
  "created_at": "2026-10-03T13:30:00Z",
  "entries": [
    {
      "code": " M",
      "path": ".agent-context/context-index.json"
    },
    {
      "code": " M",
      "path": ".agent-context/tasks/T-COMPACT-HANDOFF-001/context.lock.json"
    },
    {
      "code": " M",
      "path": ".agent-context/tasks/T-CONTINUITY-WRITE-HARDENING-001/context.lock.json"
    },
    {
      "code": " M",
      "path": ".agent-context/tasks/T-PUBLISH-CONTINUITY-001/change.yaml"
    },
    {
      "code": " M",
      "path": ".agent-context/tasks/T-PUBLISH-CONTINUITY-001/checkpoint-input.yaml"
    },
    {
      "code": " M",
      "path": ".agent-context/tasks/T-PUBLISH-CONTINUITY-001/context.lock.json"
    },
    {
      "code": " M",
      "path": ".agent-context/tasks/T-PUBLISH-CONTINUITY-001/evidence/progress.md"
    },
    {
      "code": " M",
      "path": ".agent-context/tasks/T-PUBLISH-CONTINUITY-001/state.yaml"
    },
    {
      "code": " M",
      "path": "test/continuity-write-hardening.test.ts"
    },
    {
      "code": "??",
      "path": "test/fixture-rename.test.ts"
    },
    {
      "code": "??",
      "path": "test/fixture-rename.ts"
    },
    {
      "code": " M",
      "path": "test/migration-control-evidence.test.ts"
    }
  ]
}
